"https://www.scopus.com/inward/record.uri?eid=2-s2.0-77949934851&partnerID=40&md5=0876e937215781bb53db53a5d8242475,""This work introduces an innovative low cost topology for a wind conversion system with an efficient output power control in order to meet the battery charge requirements. The project is in accord with the specifications required at IFEC 2009 (the 2009 International Future Energy Challenge, sponsored by IEEE). The proposed topology is based on a high frequency discontinuous conduction mode three-phase semi-controlled rectifier associated with buck converter. The converter is controlled by a system composed of three loops, which limit the current and the voltage to the maximum values allowed by the batteries and the voltage over the DC bus. There is also a MPPT algorithm that intends to maximize the power extracted from the turbine/generator association. © 2009 IEEE."""					
"https://www.scopus.com/inward/record.uri?eid=2-s2.0-80052681343&partnerID=40&md5=ca6b10d409cb7122b93555f6fd08d5d8,""There are already several power systems coping with large amounts of wind power. Hi h penetration of wind power has impacts that have to be manage through proper plant interconnection, integration, transmission planning, and system and market operations. This report is a summary of case studies addressing concerns about the impact of wind power.s variability and uncertainty on power system reliability and costs. The case studies summarized in this report are not easy to compare due to different methodology and data used, as well as different assumptions on the interconnection capacity available. Integration costs of wind power need to be compared to something, like the production costs or market value of wind power, or integration cost of other production forms. There is also benefit when adding wind power to power systems: it reduces the total operating costs and emissions as wind fossil fuels. Severalissues that impact on the amount of wind power that can be integrated have been identified. Large balancing areas and aggregation benefits of large areas help in reducing the variability and forecast errors of wind power as well as help in pooling more cost effective balancing resources. System operation and working electricity markets at less than day-ahead time scales help reduce forecast errors of wind power. Transmission is the key to aggregation benefits, electricity markets and larger balancing areas. From the investigated studies it follows that at wind penetrations of up to 20 % of gross demand (energy), system operating cost increases arising from wind variability and uncertainty amounted to about 1.4 ./MWh. This is 10 % or less of the wholesale value of the wind energy."""					
"https://www.scopus.com/inward/record.uri?eid=2-s2.0-77953758886&partnerID=40&md5=0ab5595f2119e7646f2d48868af1c6da,""Wind and solar technologies have experienced rapid market growth recently as a result of the growing interest for implementation of renewable energy. However, the intermittency of wind and solar power is a major obstacle to their broader use. The additional risks of unexpected interruptions and mismatch with demand have hindered the expansion of these two primary renewable resources. The goal of this research is to analyze an integrated energy system that includes a novel configuration of wind and solar coupled with two storage methods to make both wind and solar sources dispatchable during peak demand, thereby enabling their broader use. The proposed system utilizes compressed air energy storage (CAES) that is driven from wind energy and thermal storage supplied by concentrated solar thermal power in order to achieve this desired dispatchability. While current CAES facilities use off peak electricity to power their compressors, this system uses power from wind turbines to compress air to high pressure for storage. Also, rather than using natural gas for heating of the compressed air before its expansion through a turbine, which it typical for conventional systems, the system described in this paper replaces the use of natural gas with solar thermal energy and thermal storage. Through a thermodynamic and a levelised lifetime cost analysis we have been able to develop estimates of the power system performance and the cost of energy for this integrated wind-solar-storage system. What we found is that the combination of these components resulted in an efficiency of over 50% for the main power components. We also estimated that the overall system is more expensive per unit of electricity generated than two of the current technologies employed today, namely coal and nuclear, but cheaper than natural gas peaking units. However, this economic analysis, though accurate with regard to the technologies chosen, will not be complete until cost values can be placed on some of the externalities associated with power generation such as fuel cost volatility, national security, and emissions. Copyright © 2009 by ASME."""					
"https://www.scopus.com/inward/record.uri?eid=2-s2.0-77950127530&partnerID=40&md5=d64149a0f17e75b7785808084fe3671f,""An efficient hybrid distributed genetic algorithm is proposed to determine the proper number and locations of wind turbines in large wind farms. The objective of this optimal process is to find a solution that maximizes the annual profit obtained from a wind farm. It is well-known that genetic algorithms are good for global searches, but are weak for local searches. To improve the performance of finding the optimal solution in a large search space, the hybrid methodology combines a distributed genetic algorithm and steepest ascent hillclimbing local search algorithms. The hill-climbing algorithm provides a powerful strategy for searching the local optimal solution by exploring the neighborhood of the current state. In this paper, the hill-climbing algorithm is further enhanced by a heuristic method to reduce the execution time for finding the optimal value. Test results show that this proposed hybrid distributed genetic algorithm adequately demonstrates its effectiveness in solution quality and execution time. ©2009 IEEE."""					
"https://www.scopus.com/inward/record.uri?eid=2-s2.0-77951589764&partnerID=40&md5=88475b83c4d04553d6dc1b284cc1bd8b,""This work introduces an innovative low cost topology for a wind conversion system with an efficient output power control in order to meet the battery charge requirements. The project is in accord with the specifications required at IFEC 2009 (the 2009 International Future Energy Challenge, sponsored by IEEE). The proposed topology is based on a high frequency discontinuous conduction mode three-phase semi-controlled rectifier associated with buck converter. The converter is controlled by a system composed of three loops, which limit the current and the voltage to the maximum values allowed by the batteries and the voltage over the DC bus. There is also a MPPT algorithm that intends to maximize the power extracted from the turbine/generator association. ©2009 IEEE."""					
"https://www.scopus.com/inward/record.uri?eid=2-s2.0-79955615231&partnerID=40&md5=787fd8845fcf562e0ef803ba476783d9,""Shortcomings in analyses of bioenergy systems may lead to unrealistic or overoptimistic expectations for replacing fossil energy with bioenergy. This paper addresses problems faced in our study. As a rule definitions of the boundaries of bioenergy systems and assumptions made in investigations differ from one analyst to another. Therefore understanding the background of a research is at least as important as the results. Extraction of bioenergy needs also energy that is usually assumed to be fossil energy. To extract fossil energy requires considerably less efforts than that of bioenergy, which makes bioenergy chains look more energy efficient than they really are. Additionally, the indirect energy input is often inadequately analyzed and underestimated. The output energy of a biomass production chain is usually expressed as a heating value of the dry matter. However, heat is at a low level in the energy hierarchy. Refining biomass to a higher level (such as electricity or traffic fuel) causes energy losses and decreases the output. Thus energy quality should be properly included in the analysis. Biomass production needs favorable growing conditions, wind energy needs wind, and solar energy needs sunshine. Energy and a massive logistic system are needed for biomass transportation to the refinery. Storms, frost, plant deceases or insects can destroy the bioenergy crop. If the energy supply chain does not work as reliably in the future as it does today, it will have wide-spread impacts in the whole society."""					
"https://www.scopus.com/inward/record.uri?eid=2-s2.0-70449371328&partnerID=40&md5=fe96b2f8c6da86fcd5230e69a7ad025f,""Many utilities have performed wind integration studies to determine the costs attributed to wind's inherent variability and unpredictability. Changes to the operational strategies of existing generation infrastructure also contribute to the costs of integrating wind power into a power system. A valid operational strategy considered herein is the option of wind generation curtailment as a decision variable. This paper explores the question, """"Is there additional value to be gained from wind power curtailment for reasons other than grid stability?"""" Data from the hydroelectric system in British Columbia, Canada are used to perform numerous year-long simulation and optimization runs. These are performed to determine the hydro generation system's response under constrained circumstances with and without wind curtailment capability. The economic impact of curtailment to both the hydroelectric utility and the wind power producers are identified and discussed. These assumptions and impacts include changes to market prices of energy, operating reserve requirements, annual electrical energy production, hypothetical value of wind energy, and generating capacity and energy exchanges on the market. From the initial results and annual analyses of these simulation and optimization modeling runs, several observations can be made. 1) The hydroelectric utility could increase the value of wind energy very slightly (0.1% to 0.02% for wind capacity penetration levels 3% to 12%) during a dry water year if allowed the option of curtailing wind power, but still requiring it to pay the wind power producer for all available wind power. 2) Under the same requirements, but during a wet water year, the value of wind energy could increase a greater amount: 0.2% to 1.0% for wind capacity penetration levels 3% to 12%. 3) For either the dry or wet water year, total annual wind energy curtailment is less than 2.5%. This potential for adding value to wind power, although small, is interesting and is currently being studied in more detail to understand its causes. Key assumptions used in this research are outlined in the paper, and they too could be explored further to determine their effects on the value of wind energy. © CIGRE2009."""					
"https://www.scopus.com/inward/record.uri?eid=2-s2.0-77951016164&partnerID=40&md5=2909b1c86c833fcf1133e8eea8c67481,""In order to maximize the wind energy capture ratio below the rated wind speed, a two-frequency model was established for wind energy conversion system (WECS) based on multi-time-scale of wind speed and the frequency separation principle. The low and high frequency optimal controllers were designed using optimal control theory. PI optimal control was used in the low-frequency-loop, while the sliding-mode control with weighed integral gain was introduced in the high-frequency-loop. The simulation results indicate that the wind energy capture ratio and the tip speed ratio comparing with the PI control are improved by the proposed control method. Moreover, once the system is in steady-state regime, the wind energy capture ratio can be maintained around its optimal value (0.475) and the tip speed ratio around its optimal value (7), So it is feasible to maximize the wind energy capture ratio below the rated wind speed."""					
"https://www.scopus.com/inward/record.uri?eid=2-s2.0-70349929203&partnerID=40&md5=af5115a7d39e21e4cb18e29245ed1937,""Building a zero energy home requires several major considerations: site selection for the home"	 considerations to use less	 conservation of what you produce	 and evaluation the best choices of renewable resources. This paper discusses the use of climate data collection software, heat loss and heat gain considerations and software	" how to achieve a zero energy building and qualifying as a LEED (Leadership in Energy and Environmental Design) Certified Platinum home. Site selection is the first step. This first step can be taken after you have identified your goals. What alternative energy systems do you want to use? Do you want to use more than one alternative source? What other site considerations are important? In my case, I wanted to use solar energy as my primary alternative energy source. Why? I want comfort, reliability and ease of use. Other alternatives may require more maintenance. Wind power will be a second source that will be incorporated to produce electricity when the PV system can not produce. The site selected is a south facing mountain that has a steady breeze most of the time. Another consideration for me is the ability to use earth-sheltering as a measure of high efficiency construction. The south-facing mountain also provides the opportunity to """"nestle"""" into the mountainside. Calculations and basis of design are presented. Using less is a key mindset that we all need to move toward. Using less does not mean that you suffer. This house will be comfortable year round with little effort because the house uses passive solar design for lighting and space heating, active solar hot water for additional heating of the floor and domestic hot water, and PV/wind/biodiesel generator backup to generate electricity for lighting and other typical electrical loads. The construction materials provide high R-values and green products that contribute to excellent indoor air quality. SIPs (Structural Insulated Panels) will be used as the structural components for the walls and roof. All electrical appliances, refrigerator, lighting, and washer/dryer were selected to use less electricity and water. Data describing the energy requirements are provided. Reuse all that you can. I am incorporating a masonry heater, also known as a Russian Fireplace. The combustion efficiency of the masonry fireplace is typically 92-94 percent with very low emissions. The masonry fireplace will provide passive mass for passive release of the woodburning energy during the evening and heat hot water coils in the fireplace as well (as the hot water backup system). The use of hard woods from the land will provide heat overnight, heat for cooking and supply additional BTUs for domestic hot water and radiant heat. Many of the building materials that are selected for construction are from the land"	" stone and whole cut wood from the land will be used for esthetic appeal and thermal mass thereby reducing harmful manufacturer's emissions. My site is an excellent site for a hybrid solar and wind power (with a biodiesel generator as backup) system. The orientation and wind profile of the land is optimal for solar and wind energy applications. Site specific data and optimization of active solar, passive solar and PV/wind systems are presented. Life cycle costs are presented to show the cost comparison using Years-to-Payback and Return on Investment approaches for the energy systems and LEED certification costs for new construction. Copyright © 2008 by ASME."""
"https://www.scopus.com/inward/record.uri?eid=2-s2.0-68849109227&partnerID=40&md5=0d591f6195369a3fc3a9cb9d8359f5f6,""Although Turkey enjoys very important wind energy potential, the studies of the exploration and utilization this potential are still less than the level needed. In this study, the wind energy potential and wind characteristics of Kayseri province and of its some counties, located in the Central Anatolian region, were investigated using the wind speeds data hourly recorded at 10 m hub height from the year 2000 to 2006. The observed wind data were processed as annual and seasonal by means of the FORTRAN computer code. Weibull and Rayleigh probability density functions of the location using actual data are calculated. For Pinarbasi County, in the considered years, Weibull shape parameter k and scale parameter c vary between values of 1.40 and 1.59 and 3.91 and 4.26 m/s, respectively. In Pinarbasi, the mean power density varies between 65 and 90 W/ m2 according to actual data while between 75 and 100 W/ m2 according to Weibull data. In addition, for Pinarbasi, the maximum value of the mean power density according to actual data for the winter season is 170 W/ m2 in 2001. Mean power density in all of the considered years for Pinarbasi is considerable in winter and spring. As a result, Pinarbasi, among the considered sites, has a remarkable potential of wind energy for utilization and can be evaluated as a marginal area for cost-effective electrical energy generation as the costs of wind energy conversion systems are lowered. © 2009 ASCE."""					
"https://www.scopus.com/inward/record.uri?eid=2-s2.0-84869978026&partnerID=40&md5=f9e656f593a18833bdfcc8361855f1cf,""In this paper we develop a novel approach that simultaneously optimizes a wind farm and its financing for an improved economic analysis of wind energy projects. In our analysis we compare the energy yield of optimal wind energy projects with different turbine technologies under varying electricity price and wind speed scenarios. We perform extensive simulation studies and build statistical confidence intervals for the annual energy yield as well as the project's net present value at risk. The proposed approach eliminates the need for a trial- and-error financial feasibility study and, consequently, improves the harvest of the wind energy. © 2009 IEEE."""					
"https://www.scopus.com/inward/record.uri?eid=2-s2.0-66349086439&partnerID=40&md5=c4af3dfc64720317daf5224003830d9b,""This paper presents the results of a case study of applying a systematic and proven process of technology portfolio planning with the use of scenario analysis to renewable energy developments in Taiwan. The planning process starts with decision values of technology development based on a survey of society leaders. It then generates, based on expert opinions and literature search, a set of major technology alternatives, which in this study include: wind energy, photovoltaic, bio-energy, solar thermal power, ocean energy, and geothermal energy. Through a committee of technical experts with diversified professional backgrounds, the process in this study next constructs three scenarios (""""Season in the Sun"""", """"More Desire than Energy"""", and """"Castle in the Air"""") to encompass future uncertainties in the relationships between the technology alternatives and the decision values. Finally, through a second committee of professionals, the process assesses the importance and risks of these alternative technologies and develops a general strategic plan for the renewable energy technology portfolio that is responsive and robust for the future scenarios. The most important contributions of this paper are the clear description of the systematic process of technology portfolio planning and scenario analysis, the detailed demonstration of their application through a case study on the renewable energy development in Taiwan, and the valuable results and insights gained from the application. © 2009 Elsevier Ltd. All rights reserved."""					
"https://www.scopus.com/inward/record.uri?eid=2-s2.0-77649313571&partnerID=40&md5=6e99f83d2851fb4c08e322b7e8908d3f,""Complying with the decision made by the Jordanian government to install a new wind power plant with a capacity ranging between 50-75 MW-to complement the Hofa and Ibrahimiyya wind power plants, whose electricity production presently forms only about 0.035% of the total electricity generated in Jordan mainly by power plants operating on conventional fuels-a 50 MW grid-connected wind power plant for electricity generation is proposed. Long-term (1993-2004) measured wind speed data at 24 widespread Jordanian sites was analyzed, and formed-in addition to the plant's specifications and parametersan input data to carry out evaluation of the proposed plant's electricity production and analysis of its economic feasibility. It was found that the mean annual value of wind speed for Jordan is 5.5 m/s and that the seasonal trend of wind speed-for most of the studied sites and Jordan as a wholematches the electricity load trend in the country. It was also found that RasMuneef, among the studied sites, has the highest annual mean wind speed of 10.65 m/s, the highest electricity production of 260.9 GWh/year, the highest specific yield of 1,882 kWh/m2, and the best economic indicators, i.e., internal rate of return, simple payback period, years-to positive cash flow, net present value, annual life cycle saving, benefit-cost ratio, and cost of energy. Moreover, it was found that about 201,417 tons of greenhouse gas emissions can be avoided annually if utilizing the proposed plant for electricity generation at RasMuneef instead of plants operating on conventional fuels. Therefore, employing the proposed power plant for electricity generation, in Jordan in general and in RasMuneef in particular, is highly recommended."""					
"https://www.scopus.com/inward/record.uri?eid=2-s2.0-66849101591&partnerID=40&md5=dcab5816cddd06aa40e065c58a11bec2,""Self-excited induction generators (SEIG) are increasingly being used in isolated areas to generate electrical energy from both conventional and nonconventional energy sources. This paper proposes a novel method of evaluating the steady-state performance characteristics of a SEIG under various operating conditions. The criteria for the constant terminal voltage and the constant-stator-current operations are also derived and embedded into the system of equations. Unlike the previous methods of analysis, the problem is formulated in a simple and straightforward way without going through lengthy and tedious derivation for the coefficients of a set of nonlinear equations. The formulated problem is then solved using a numerical-based routine """"fsolve""""given in MATLAB. The effectiveness of the proposed method is then evaluated on a 220-V, 1.5-kW induction generator for various operating conditions. Some of the simulation results obtained by the proposed method are also compared with the corresponding experimental values and are found to be in very good agreement. © 2009 IEEE."""					
"https://www.scopus.com/inward/record.uri?eid=2-s2.0-70350414413&partnerID=40&md5=9e3552cef85769d6082709bca9efe41b,""As the penetration of wind energy continues to increase around the world, the impact of wind energy on the management of electrical grids is becoming increasingly evident. The challenge for the grid operator of integrating wind energy, or for the energy trader to maximise the market value of the energy, is toughest during periods of rapid change in wind farm production, or ramp events. These events are also tough to forecast accurately, and it is therefore essential to understand the uncertainty of forecasting such events. To date the majority of work on the uncertainty of wind energy forecasts has been focused on the possible amplitude of wind production that might occur at a given time. However, there has been limited investigation into effectively defining the possible timing of significant wind energy events. This paper aims to focus on methodologies for generating temporal forecast uncertainty for rapid changes in wind farm production. The first challenge is to define ramp events, secondly the forecast uncertainty needs to be calculated and finally this information needs to be presented clearly to the end user. This paper covers these three areas, with a focus on the method of calculating forecast uncertainty using multiple NWP inputs, statistical processing and adaptive algorithms. The results are based on GH Forecaster services for both individual and portfolios of wind farms. The outcome of the investigation demonstrates that temporal forecast uncertainty can be calculated and clearly presented to indicate the likely timing and amplitude of wind energy ramp events."""					
