"https://www.scopus.com/inward/record.uri?eid=2-s2.0-79952772129&partnerID=40&md5=8d384f948ed4387e7e852f0a1ff0e241,""This paper describes the simulation model and the harmonics analysis of cascaded five level H-bridge inverters fed RL load and induction motor load system for stand alone applications. The SEIG fed H- bridge multi level inverter (MLI) for variable speed wind energy conversion systems are considered for various stand alone applications. In this paper, the SEIG fed cascaded five level inverters for induction motor load systems are clearly explained with the help of MATLAB / SIMULINK models. The generated voltage of the wind driven self - excited induction generator (SEIG) is mainly depending on the wind velocity fluctuations, appropriate capacitance values and load conditions. The five level cascaded inverters has interface with the wind driven self - excited induction generator (SEIG). The variable magnitude, variable frequency voltage of the generator can be controlled by choosing the proper modulation index. The simulation and harmonic analysis of the proposed inverter will be discussed and the total harmonic distortion will be evaluated. © 2010 IEEE."""					
"https://www.scopus.com/inward/record.uri?eid=2-s2.0-77954312030&partnerID=40&md5=7b8d2358b5c2508e5c58fa3eccb9a417,""This paper presents a wind energy assessment and a wind farm simulation in the city of Triunfo in the state of Pernambuco in the northeast region of Brazil. The wind data were obtained from the SONDA (Sistema de Organização Nacional de Dados Ambientais) project's meteor station (wind speed, wind direction and temperature) at both heights of 50 m during a period of time of 30 months. The Triunfo wind characterization and wind power potential assessment study shows an average wind speed (V) of 11.27 m/s (predominant Southeast wind direction), an average wind power density (P/AT) of 1.672 W/m2 and Weibull parameters shape (K) and scale (A) respectively equal to 2.0 and 12.7 m/s. Those values demonstrate an important wind potential in this region for future wind farm prospection. The wind farm (TRI) was simulated by using 850 kW wind turbines given a total of 20 MW installed. The simulated results show(s) an AEP (annual energy produced) of 111.4 GWh, a capacity factor (Cf) of 62% and a total of 5.462 h of operation by year (full load hours). The economical simulated results show(s) a Pay-back of 3 years Internal Rate of Return (IRR) of 47% and Net Present Value (NPV) of 85.506 k€ (both in a period of time of 20 years). © 2010 Elsevier Ltd."""					
"https://www.scopus.com/inward/record.uri?eid=2-s2.0-79952728079&partnerID=40&md5=7b4794832ff4eabb9f7df5c3456b9b24,""The main aim of this paper is to explore the various dynamic controllers for regulating the reactive power requirements of grid connected wind farms. A wind farm of total capacity 7.5 MW is considered for the study. The turbines are of fixed-speed type that are equipped with squirrel-cage induction generators. The emerging devices suggested for the control of the reactive power requirement of wind generators such as Static Var Compensators (SVC), Static Synchronous Compensators (STATCOM) and Unified Power Flow Controllers (UPFC) are modelled and analysed to study their effect on the voltage at the point of common coupling (PCC) and rotor speed of the induction generators. The gains of these controllers are tuned using a simple Genetic Algorithm (GA). The study has demonstrated appreciable improvement in the voltage ride-through capability. This has increased the penetration level of wind power into existing distribution networks in many countries. © 2010 IEEE."""					
"https://www.scopus.com/inward/record.uri?eid=2-s2.0-78751562951&partnerID=40&md5=0366af9529a4fad0d5dd171448cfea58,""With the advent of an era of the high fossil energy cost and growing environment consciousness, wind power is gaining great favor over other traditional energy sources. Large scale usage of wind energy can significantly reduce the pollutions and carbon emission otherwise caused by fossil fuel. In many cases, with tax incentive, investment in wind energy can also reduce the operational cost of generating companies. One difficulty of integrating large scale wind power is related to the uncertainty in wind power. Unlike hydro energy which is also renewable and intermittent, wind power output is hard to predict precisely due to the indeterminacy in wind speed. The uncertainty not only causes difficulty in scheduling, but also system stability and security concerns in operation. This work proposed a short-term(24 hours) optimal economical dispatch model and developed a risk evaluation method for the short-term operation of power systems with high wind penetration, considering the wind variability. We use the Particle Swarm Optimization(PSO) algorithm with constraints to solve the dispatch problem above. The Value at Risk(VaR) and Utility function(UF) are used to evaluate the risk and make a optimal tradeoff between the profit and risk for the system operators. The algorithms are tested on the standard IEEE 30-bus power system to validate the applicability. ©2010 IEEE."""					
"https://www.scopus.com/inward/record.uri?eid=2-s2.0-79953140666&partnerID=40&md5=7190e3a546a0da6c78175372c136cee1,""While renewable resources most certainly provide environmental benefits, and also help to meet aggressive renewable energy targets, their deployment has pronounced impacts on system operations. There is an acute need to understand these impacts in order to fully harness the benefits of renewable resource integration. In this paper we focus on the integration of wind energy resources in a multi-settlement electricity market structure. We study the dynamic competitive equilibrium for a stochastic market model, and obtain closed form expressions for the supplier and consumer surpluses. Numerical results based on these formulae show that the value of wind generation to consumers, under the current operational practices, falls dramatically with volatility. In fact, we can establish thresholds for the coefficient of variation beyond which the value of wind is questionable. These findings emphasize the need to investigate operational schemes that address volatility. ©2010 IEEE."""					
"https://www.scopus.com/inward/record.uri?eid=2-s2.0-79955975820&partnerID=40&md5=f3ce9cd48cfee7d2149b278e0ace75f7,""The purpose of this study is to survey these natural energy resources such as Water Energy, Wind Energy and Solar Energy in each area of Chiang Rai and to find the suitable format of manufacturing electric current from natural energy area in Chiang Rai. The survey consists of acquiring natural energy in each area of Chiang Rai using a surveying tool as Flow water Meter, a Digital Anemometer, and Digital Light Meter. Wind energy uses 5 times measurement among 4 directions, north, south, east and west direction which 6 time ranges are verified from 08.00 a.m., 10.00 a.m., 12.00 a.m., 2.00 p.m., 4.00 p.m., and 6.00 p.m. after that the maximum value/day, minimum value/day, and total average values are calculated. Water energy with 5 times measurement are verified from 08.00 a.m., 10.00 a.m., 12.00 a.m., 2.00 p.m., 4.00 p.m., and 6.00 p.m. after that the maximum value/day, minimum value/day, total average values and using surveyed depth of water. Solar energy as well as ranging 5 times measurement during 08.00 a.m., 10.00 a.m., 12.00 a.m., 2.00 p.m., 4.00 p.m., 6.00 p.m. then the maximum value/day, minimum value/day, and total average value are calculated. Result of surveying the natural energy resources in Chiang Rai during August - October 2008 was Test Value of Wind Energy = 5 m/s, [11] for electric current can be generated in 6 sub districts in Tung Kor, Wiang Chiang Saen, Wiang Nuea, Ban Du Sub District Municipality, Pong Noi, and Mae Suai Sub District Municipality. Test Value of Solar Energy = 50,000 LUX, [11] for electric current can be generated in 13 sub districts, Chok Chai, Tung Kor, Nang Lae, Pa Ngae, Pa Tan, Pong Pa, Mae Kham, Wiang Nuea, Pong Noi, Mae Sai Sub District Municipality. Wiang Ka Long Sub District Municipality, Muang Phan Sub District Municipality and Mae Suai Sub District Municipality. Test Value of Water Energy = 13 m/s, [11] for electric current can be generated in 2 Sub Districts, Wiang Chiang Saen and Chok Chai. Result of surveying the format for natural energy resources, Wind energy, Solar energy and Water energy within 18 area in Chiang Rai indicated an appropriate value of Wind energy with Test Value = 5 m/s for electric current generator for 6 sub districts could be generated but 12 areas could not be generated. Solar energy for electric current generator in 13 Sub Districts could be generated with available Test Value = 50,000 LUX but 5 Sub Districts could not be generated. Water energy for electric current generator 2 Sub Districts could be generated but 16 Sub Districts could not be generated with available Test Value = 13 m/s."""					
"https://www.scopus.com/inward/record.uri?eid=2-s2.0-77957853913&partnerID=40&md5=a970c0a50f7d3e30d95f2ce096eb665f,""Wind energy is a clear, safe and renewable green energy resource. Because it can be supplied inexhaustibly and always be used availably, it is exploited by countries all over the world and has gradually become a new energy type. According to the wind energy characteristics and the hydrodynamics theory, the vertical axial wind turbine of three hastate windmill, which can convey the intra-cavity wind energy, is developed in this paper. The power principles of permanent magnet is used to construct the technique of the speed loss and controlled wind power generation which is coaxial with the wind turbine of three hastate windmill. The experimental results show that this invention has many advantages such as simple structure, high utilization efficiency of wind energy, low startup wind speed, high equipment reliability and good maintainability. This invention has broad application prospect in the market with great economic value, and profound social significance on the environment-friendly green energy industries of China and even the whole world."""					
"https://www.scopus.com/inward/record.uri?eid=2-s2.0-77954957295&partnerID=40&md5=e563ba771576cfa6f503e9e24c33d30a,""A method for prediction of wind speed at a selected location based on the data collected at neighborhood locations is presented. The affinity of wind speeds measured at different locations is defined by Pearson's correlation coefficient. Five turbines with similar wind conditions are selected among 30 wind turbines for in-depth analysis. The wind data from these turbines are used to predict wind speed at a selected location. A neural network ensemble is used to predict the value of wind speed at the turbine of interest. The models have been tested and the computational results are discussed. The results demonstrate that a higher Pearson's correlation coefficient between the wind speeds measured at different turbines has produced better prediction accuracy for the same training and test scenario. © 2010 Elsevier Ltd."""					
"https://www.scopus.com/inward/record.uri?eid=2-s2.0-77956954429&partnerID=40&md5=db36e378e5eef7b9af3f3449637a9d88,""This paper discusses the current context of offshore wind development. It notes that experiences can be drawn from more mature offshore industries such as oil and gas. It further argues that contemporary opportunities and challenges within offshore wind are multifaceted and that a multidisciplinary approach is required to grasp the full risk picture and to optimise returns. The paper introduces Value Chain Assessment (VCA) as an adequate methodology to optimise the balance between risks and returns in offshore wind developments. Two illustrative cases of VCA application are included at the end of the paper. © 2010: The Royal Institution of Naval Architects."""					
"https://www.scopus.com/inward/record.uri?eid=2-s2.0-77956450538&partnerID=40&md5=466d3765e9da0d3d739a599a017054db,""The power output by weather-driven renewable resources such as wind energy conversion systems can be appropriately described as being stochastic. To manage these resources, probabilistic models of wind power are being increasingly employed by power system stakeholders in applications such as stochastic unit-commitment programs and wind power forecast systems. This paper evaluates probabilistic models-specifically the probability density functions-of aggregate wind plant power output and conditional and unconditional variations of aggregate wind plant power output. The parameters of the models are fit to historical aggregate wind plant power data from three large North American systems. Parametric and non-parametric evaluations of the suitability of the models are performed in the form of 2 goodness-of-fit tests and through the inspection of probability plots and histograms. It is shown that Beta distributions are appropriate models for the aggregate power output and Laplace distributions are appropriate models for wind power variability. Conditional wind power variation follows a generalized extreme value distribution. © 2010 IEEE."""					
"https://www.scopus.com/inward/record.uri?eid=2-s2.0-77955279506&partnerID=40&md5=12ee836b072244f019ccda0dd61e1102,""Wind energy is currently one of the types of renewable energy with a large generation capacity. However, since the operation of wind power generation is challenging due to its intermittent characteristics, forecasting wind power generation efficiently is essential for economic operation. This paper proposes a new method of wind power and speed forecasting using a multi-layer feed-forward neural network (MFNN) to develop forecasting in time-scales that can vary from a few minutes to an hour. Inputs for the MFNN are modeled by fuzzy numbers because the measurement facilities provide maximum, average and minimum values. Then simultaneous perturbation stochastic approximation (SPSA) algorithm is employed to train the MFNN. Real wind power generation and wind speed data measured at a wind farm are used for simulation. Comparative studies between the proposed method and traditional methods are shown. © 2010 Elsevier Ltd."""					
"https://www.scopus.com/inward/record.uri?eid=2-s2.0-77955938716&partnerID=40&md5=b713e11f47b03fde0278931b83643f6b,""Lawrence Technological University (LTU) in 2007 and 2008 conducted a one week long Alternative Energy Summer Camp for high school students. This summer camp is one of several on-campus camps at Lawrence Tech that give high school students the opportunity to learn about specific technologies and to interact with full-time university science and engineering faculty. The Alternative Energy Summer Camp focuses on the major technologies in this field, including solar heating, solar photovoltaics, wind energy, geothermal systems, and fuel cell and hydrogen technologies. This camp was held with a limited enrollment to help assure close faculty contact and to give thestudents maximum opportunities to obtain hands-on experiences with the major associated equipment in our university's Alternative Energy Laboratory. This paper evaluates the evolution of the summer camp structure, as well as assesses and reviews the feasibility, benefits, and value of conducting this summer camp over two summer sessions. Detailed assessment data obtained from the student participants (by survey and interviews), as well as feedback from participating faculty from both summer sessions that augment the understanding and value of such work to both student and institution are provided and reviewed. We have found that students not only gained a significant understanding of the Alternative Energy technologies, but also increased their desire to pursue the study of such technologies when they enrolled in college. Students also indicated an increased interest in pursuing an engineering degree in general. The results of this effort at LTU strongly support the value and benefits ofholding such summer camps for the recruitment and expansion of student appreciation of the Alternative Energy field. © American Society for Engineering Education, 2010."""					
"https://www.scopus.com/inward/record.uri?eid=2-s2.0-77952828068&partnerID=40&md5=3539f903c81fcff49578f585c266904e,""This study presents a comparative analysis of three different energy production process (EPP) scenarios for Turkey. Main goal is to incorporate the prioritization criteria for the assessment of various energy policies for power alternatives, and evaluating these policies against these criteria. The three types of EPPs reviewed in this study are: electricity production from wind farms in the future, existing coal-based thermal power plants and planned nuclear power plants. The analytical hierarchy process (AHP) is utilized to assess the main and sub-factors of EPPs. Main factors such as economic, technical, social and environmental are assigned in first level of the AHP. The importance weights of factors are produced and priority values with realistic numbers are obtained using Fuzzy-AHP Chang's Model. Priority value for wind energy was determined as two times higher than the others when making the ultimate decision. On aggregate, importance weights of environmental (0.68) and social (0.69) factors make wind power leader. Sub-factors such as public acceptance, waste-emission and environmental impacts cause both nuclear and thermal power to have the lowest priority numbers. Additionally, the CO2 emissions trade was determined to be a very important criterion associated with both economic and environmental factors according to Kyoto Protocol. This study concludes that Turkey's existing thermal power stations should gradually be substituted by renewable energy options according to a schedule of Turkish energy policies in future. © 2010 Elsevier Ltd."""					
"https://www.scopus.com/inward/record.uri?eid=2-s2.0-77954570369&partnerID=40&md5=8e5b05a94e2c2f80f1d975737b3ba663,""This paper represents the speed regulation for a fixed pitch stallregulated variable speed wind energy conversion system. The speed regulation in the low wind speeds (below rated) region is the main topic of this paper where in this region, the rotor/generator speed activity is controlled by using the concept of adjustable or variable speed drive (ASD/VSD). Speeds need to be controlled in order to obtain maximum power by keeping the power coefficient at the peak curve by maintaining the tip speed ratio at the optimum value. To achieve this, the closed- loop scalar speed control with the concept of constant ratio of voltage/frequency is applied. Yet, simple algorithms of drive train and squirrel cage induction generator are used. A proportional integral (PI) controller was used to control the generator slip speed. Results demonstrate that such a closed-loop scalar control with proportional integral (PI) controller is good enough to accurately track maximum power at the optimum rotational speed corresponding to the wind speeds variation below the rated wind speed."""					
"https://www.scopus.com/inward/record.uri?eid=2-s2.0-77952401429&partnerID=40&md5=c2854a40fb77efa613ea7a01514e837a,""There is an increasing interest in adding renewables such as wind to electricity generation portfolios in larger amounts as one response to concern about atmospheric carbon emissions from our energy system and the resulting climate change. Most policies with the aim of promoting renewables (e.g., RPS, FIT) do not explicitly address siting issues, which for wind energy are currently approached as the intersection of wind resource, land control, and transmission factors. This work proposes the use of locational marginal price (LMP), the location and time specific cost of electricity on the wholesale market, to signal locations where generation can address electricity system insufficiency. After an examination of the spatial and temporal behavior of LMP in Michigan over the first two years of wholesale market operation, this work combines LMP with wind speed data to generate a value metric. High value sites in Michigan tend to be sites with higher wind speeds, with the bulk of value accruing in the fall and winter seasons. © 2009 Elsevier Ltd."""					
"https://www.scopus.com/inward/record.uri?eid=2-s2.0-77954873184&partnerID=40&md5=94faeaf90c7aad926626791a8d59cfb2,""Intermittent renewable energy sources (RES) are promising to be the future of electricity generation. In particular wind generation, owing to its stochastic behaviour, has to be carefully managed. Its lack of sufficient predictability decreases the energy value in the current framework of electrical markets, therefore, beyond a certain threshold"	" this kind of generation into the electrical system represents a problem for the transmission system operator (TSO) during its despatching service. The coupling of wind energy conversion system (WECS) with a storage medium (i.e. hydrogen) could improve the programmability of such generation plants in electrical markets. In this paper, an economical optimization tool has been developed in order to find the short-term scheduling so as to maximize the economic revenues in the day-ahead electricity market of a storage plant coupled with a wind farm. This tool needs as input the forecasts of both wind generation power and market prices, obtained with the adoption of pre-processing input data algorithm based on different methods that involve both statistical and probabilistic approaches. Copyright © 2009 John Wiley & Sons, Ltd."""				
"https://www.scopus.com/inward/record.uri?eid=2-s2.0-77954477064&partnerID=40&md5=a7dbc084a166eb76b4fb5d0a74f1d744,""The values held by people in respect of the places that they live in, work in or enjoy, influence the way in which they react to proposals for offshore wind farms that would be visible from coastlines. However, provision for public participation in the Planning Act 2008, under which large offshore wind farms are to be regulated, is inadequate for identifying whether such development would be seen as problematic by those whom it would affect. In this article, I argue that deliberative participation in local and regional plan-making would provide a better means of exploring how offshore infrastructure and popularly held values in places and seascapes might interact, and thereby for determining the extent to which wind farms would be publicly acceptable in coastal waters. It would also reduce the scope for delay to planning from public opposition to which the Government attributes its difficulties with advancing its policies for terrestrial renewable energy generation. © The Author [2010]. Published by Oxford University Press. All rights reserved. For Permissions, please email: journals.permissions@oxfordjournals.org."""					
"https://www.scopus.com/inward/record.uri?eid=2-s2.0-77953117327&partnerID=40&md5=cb956ed8cbed58ebe637c6bc718f5370,""When the wind speed is below the rated value, the generator is controlled to maximize the captured wind energy. According to multi-time scale of wind speed, the nonlinear mechanical model for wind energy conversion system (WECS) is established, and the Linear Parameter Varying (LPV) system model is released. Based on PI control strategy, the LPV gain scheduling control is taken as dynamic compensation technology. Simulation results show that the power coefficient and the tip speed ratio have much better accuracy and robustness in tracing their optimal value after compensation, which result in better dynamic performances. ©2010 IEEE."""					
"https://www.scopus.com/inward/record.uri?eid=2-s2.0-84869994411&partnerID=40&md5=3dfe54a0fc6922bcba0ec525127c9aa7,""The rotor of the doubly fed induction generator (DFIG) is fed back from the grid via back-to-back converters. Under the disturbance, the rotor current increases to maintain the terminal voltage and the rotor rotating speed of DFIG, while the current in the grid side converter also increases to keep the DC-Link voltage constant. In this situation, the overshoots of the currents flowing through the converters stress the operation condition of the back-to-back converters, even destroy the converters. The controllers of the back-to-back converters have significant impact on the dynamics of the rotor current. In this paper, the parameters of back-to-back converter controller are tuned with the objective of reducing the maximum value of the currents using particle swarm optimization. Using the parameters optimized, the overshoot of the currents can be decreased. ©2010 IEEE."""					
"https://www.scopus.com/inward/record.uri?eid=2-s2.0-77951627778&partnerID=40&md5=5f8687be69f02cd9ac4b0941348d91fe,""Selected outputs from simulations with the regional climate model REMO from the Max Planck Institute, Hamburg, Germany were studied in connection with wind energy resource assessment. It was found that the mean wind characteristics based on observations from six mid-latitude stations are well described by the standard winds derived from the REMO pressure data. The mean wind parameters include the directional wind distribution, directional and omni-directional mean values and Weibull fitting parameters, spectral analysis and interannual variability of the standard winds. It was also found that, on average, the wind characteristics from REMO are in better agreement with observations than those derived from the National Centers for Environmental Prediction/National Center for Atmospheric Research (NCEP/NCAR) reanalysis pressure data. The spatial correlation of REMO surface winds in Europe is consistent with that of the NCEP/NCAR surface winds, as well as published observations over Europe at synoptic scales. Therefore, REMO outputs are well suited for wind energy assessment application in Northern Europe. Copyright © 2009 John Wiley & Sons, Ltd."""					
