"https://www.scopus.com/inward/record.uri?eid=2-s2.0-84866721062&partnerID=40&md5=1f35233df520530074cafb8ed82c8f4e,""Wind tunnel experiments were performed to quantify the drag reduction on a wind turbine airfoil partially or fully covered with riblets. A full-scale 2.5 MW wind turbine airfoil section, typical for the near tip, was placed in the free stream flow of the wind tunnel at the Saint Anthony Falls Laboratory, University of Minnesota. Various sizes and geometries of experimental riblets were provided by 3M Company and tested at angles of attack ranging from 0° ? ? ? 10° (0.25 ? C L ? 1.14) and at a Reynolds number of Re = 2.2 × 10 6. Mean drag was measured via wake survey (momentum deficit) and with a sensitive force balance. Lift was measured directly from the force balance. Tests included the cases of complete and partial riblet coverage on the wing. Results indicated that riblets could provide an overall reduction of skin friction drag, and that the amount of the decrease varied with riblet height and geometry. Partial riblet coverage appears in some cases more efficient than its complete coverage counterpart. The percentage of drag the riblets reduced varied greatly and in some cases the riblets were even detrimental to the airfoil. The most efficient riblet for a completely covered airfoil was found to be the V-groove shape of 100 ?m height. It produced a reduction of roughly 6% in the operational range expected in a turbine airfoil. On the other hand, the most efficient riblet size for partial coverage was also a V-groove shape and seemed to shift slightly to a smaller peak height of 80 ?m. This configuration produced a reduction of roughly 4% in the range of angle of attack that is typical for operation in the field. The average non-dimensional square root of the groove cross-section, l +, defined in terms of the drag coefficient at design angle of attack for the optimum riblet configuration in the fully coverage case was found to be l +?10, which is very close to the optimum value found for planar surfaces. Based on our results we propose a formulation for the optimum riblet size in airfoil considering the mean drag coefficient and chord length Reynolds number. Even though the optimum full coverage case showed better performance that the partial case, the additional drag reduction benefit may be offset by the additional application cost. © 2012 Elsevier Ltd."""					
"https://www.scopus.com/inward/record.uri?eid=2-s2.0-84933576387&partnerID=40&md5=acc78f8e4e8186cc112d8237a3bb44e6,""The development of distributed wind energy has progressed steadily in many areas of the country but has lagged in Maryland, Virginia and North Carolina. Distributed wind energy applications are an attractive option in some Mid- Atlantic States and may be the key to unlocking the potential of a large and economically viable resource. Although the economic value of distributed wind plants is not significantly less than elsewhere, especially in coastal areas, deployment has been slow. Two issues that contribute to this apathetic growth are discussed in this paper. First, there is a general lack of wind resource measurement data especially at potentially good wind sites and therefore existing sources and models may be under predicting the potential. Early regional wind maps showed marginal wind energy potential at 50 meter height. Today it is known that better resources exist at hub height and above on today's commercial turbines. Second, the Federal wind program focused most attention on defined resources the Midwest. Another reason for slow growth is that weak policies act as a deterrent to the entire multistate region. In Maryland and Virginia, existing renewable portfolio programs can be satisfied with renewable energy credits (""""RECs"""") generated by projects that existed long before the portfolio standards or can be purchased elsewhere in the country (except solar RECs must originate Maryland). Crediting pre-existing biomass projects with RECs diminishes the efficacy of portfolio programs. North Carolina limits REC to new sources but has conservative goals and other limitations due to view-shed issues. Maryland recently introduced net metering rules that are attractive to wind and solar by allowing some customers to sell electricity back up to 200% of the normal consumption. The price is retail or about 8-10 cents/kWh less transport and administration fees. This is allowed for projects smaller than two megawatts. As the flaws in the renewable portfolio programs are fixed and the significant economic value of the existing incentives are recognized, distributed wind is likely to be the precursor to large scale wind deployment in the mid-Atlantic region. Copyright © (2013) by American Solar Energy Society."""					
"https://www.scopus.com/inward/record.uri?eid=2-s2.0-84870436998&partnerID=40&md5=6f394ccbdb60c9da8a0d533e462bde7a,""In this article we develop the overall model of the wind energy conversion systems (WECSs) structure based on the permanent magnet synchronous generator (PMSG), and propose a study of the electrical parts (permanent magnet synchronous machine and static converter). Our study is developed on a wind conversion system in order to produce optimum power (to extract the maximal wind power). The speed control of all machine-turbine at optimal values can provide a valuable service and useful for the management and generation of power network to which the turbine is connected. The main drawback is that the WECS is highly nonlinear, and thus a nonlinear control strategy is required. An adaptive Fuzzy-PI speed controller is proposed to overcome this problem. Simulation results are given to show the effectiveness of this control strategy. Conclusions are summarized in the last section. © 2012 Elsevier Ltd. All rights reserved."""					
"https://www.scopus.com/inward/record.uri?eid=2-s2.0-84867573961&partnerID=40&md5=f78757fdade83db77ffa88bdf2c80998,""The wind power industry is growing rapidly. Wind turbines (WTs) are perceived as a low environmental impact energy generation technology. While the service life of a WT is relatively long (20-40 years), at some point a significant number of WTs will reach the end of their service lives. To recover maximum value from these WTs, planning for the end-of-service life of wind turbines (EOSLWTs) is paramount. Historically, environmental life cycle assessments of WTs have often only considered the materials extraction and processing, manufacturing, and use phases, leaving the management of EOSLWTs outside the scope of their attention. Four key EOSLWTs issues that are essential for the continuing development of wind energy technologies are presented: i) The challenges of managing of EOSLWTs given the fast growth rate of the industry and the large number of existing installed WTs"	 ii) The EOSLWT alternatives such as remanufacturing and recycling to recover functional and material value respectively	 iii) The critical activities in the WT reverse supply chain such as recovery methods, logistics of transportation, quality of returns, and quality of reprocessed WTs	" and iv) The economic and business issues associated with EOSLWTs. It is expected that the discussion provided will stimulate a dialog among decision makers and raise awareness of economic opportunities and unanticipated challenges in the wind power industry. © 2012 Elsevier Ltd. All rights reserved."""		
"https://www.scopus.com/inward/record.uri?eid=2-s2.0-84870163692&partnerID=40&md5=d2399b5e8fe0e6ad90fba9fdfef78acb,""There is a progressive acceptance about the proposal of wind as an alternative source of energy to meet future global demand and significant reduction of environmental pollution. In this context, from design to decommission, safety doubtless represents an integral element of wind turbines. Based on historical accident data the quantitative risk measure of societal risk in connection with wind farms was evaluated in the present work. It was considered the CWIF database which contains information on accidents, incidents and fatalities related to wind technology from the 1970s to October 2011. The data were presented in its absolute values and normalized by the capacity of wind power installed worldwide over the years. The security level observed due to the wind turbine operation tends to increase with the increment of installed capacity. The social risk was calculated for two particular cases (characteristically arbitrary). As observed by the results (the curves in the F-N diagram) obtained for both scenarios, the risk does not exceed the upper limit of ALARP criterion. Nonetheless, the required application of principles for the integration of safety to tackle the hazards linked with wind turbines must not be neglected. Safety must be increased as the wind energy production expands, as well as there should be a need for regular reconsideration. © 2012 Elsevier Ltd."""					
"https://www.scopus.com/inward/record.uri?eid=2-s2.0-84870740133&partnerID=40&md5=7c9d715ba17bcd2a6e1bad09f017cc83,""Wind power generation is growing rapidly in many locations around the world. Power systems are able to absorb large amounts of wind capacity, but operational problems arise when the wind power penetration becomes high. Such factors as voltage dips, frequency variations, low power system stability, low reactive power and power flow imbalances reduce the economic value and represent a barrier to the unlimited development of wind energy. Hydrogen production from wind power that is not matched with hourly electricity demand appears to be an attractive storage option capable of providing a balancing service to the electricity generators and suppliers for mitigation of the negative impacts due to the random nature of wind. Because of its multi-functionality, hydrogen can be used directly as a fuel, mixed with methane, or transmitted through pipelines to the users. The aim of this paper is to produce useful suggestions for the planning, development and sizing of wind-hydrogen systems by taking into account the local and regional resources, demands, constraints and opportunities. This study considers both the economic and technological variables and describes an optimisation method (OM) for analysing power systems in which part of the electricity generated by a grid-connected wind plant is used to produce hydrogen by electrolysis. An example application of this OM has been developed for a specific geographical area located in central Sicily. Our results identify the potential and the limitations connected to cases that use excess wind power to produce hydrogen for civil applications. © 2012 Elsevier Ltd."""					
"https://www.scopus.com/inward/record.uri?eid=2-s2.0-84870780151&partnerID=40&md5=0a87d7df9ee12a2a5bf3caa082e14b35,""This work presents the design of a neural network which combines higher order terms in its input layer and an Extended Kalman Filter (EKF) based algorithm for its training. The neural network based scheme is defined as a Higher Order Neural Network (HONN) and its applicability is illustrated by means of time series forecasting for three important variables present in smart grids: Electric Load Demand (ELD), Wind Speed (WS) and Wind Energy Generation (WEG). The proposed model is trained and tested using real data values taken from a microgrid system in the UADY School of Engineering. The length of the regression vector is determined via the Lipschitz quotients methodology. © 2012 TSI Press."""					
"https://www.scopus.com/inward/record.uri?eid=2-s2.0-84870575675&partnerID=40&md5=fca312cdaa993f7f497ff449f965a0da,""Large amounts of wind and/or solar energy will have an impact on bulk electricity markets. This panel presentation will provide insight to how scheduling and dispatch rules can help to efficiently integrate wind and solar generation. Possible proxies for wind and solar capacity values that may be useful in capacity markets are also discussed. © 2012 IEEE."""					
"https://www.scopus.com/inward/record.uri?eid=2-s2.0-84870596197&partnerID=40&md5=8229c6eaa1d6a0c2005a02e146eb4062,""In the scope of a further increase in the production of renewable energy, grid-connected small wind turbines offer a promising new technology. To ensure a market breakthrough of small wind turbines, the cost effectiveness must be maximized. Therefore, the aerodynamic efficiency or power coefficient of the turbine blades is an important factor. This power coefficient is determined by the Tip Speed Ratio (TSR), which characterizes the air flow around the blade. The control of the converter must regulate the TSR of the turbine at the most optimal value to maximize the power coefficient. This is done by the Maximum Power Point Tracking (MPPT) algorithm. In this paper, measurement data of three commercial wind turbines is used to evaluate the MPPT performance. The real TSR will be calculated from the measurements and compared to the optimal value for each wind speed. This allows to investigate whether the MPPT performs adequately. From the difference between the real TSR and the optimal TSR, an estimation will be made of the loss of energy yield caused by the possible ineffective operation of the MPPT algorithm. This paper shows and estimates the room for improvement in the MPPT of small wind turbines. © 2012 IEEE."""					
"https://www.scopus.com/inward/record.uri?eid=2-s2.0-84873258029&partnerID=40&md5=2bfb609b5350deaf42c89de5730a1cc4,""In view of the problems of nonlinearity of wind energy conversion system (WECS) and uncertainty of parameters, a T-S fuzzy state feedback controller is established based on a fuzzy performance evaluator. The high-speed shaft rotational speed and electromagnetic torque are used as premise variables. A nondestructive testing method is applied. The fuzzy state feedback controller of globe models is established using membership functions. The fuzzy dynamic model of wind energy conversion systems is realized, and the modeling errors and disturbances are decreased. Simulation results demonstrate that with the proposed controller, the wind energy capture ratio and the tip speed ratio can be maintained around the optimal values, and the maximization of wind energy capture ratio under the rated wind velocity is realized."""					
"https://www.scopus.com/inward/record.uri?eid=2-s2.0-84874465472&partnerID=40&md5=f4d4884c665cfb195efa8173452bca55,""Accurate wind forecast at a wind farm is an essential process in wind energy industry and marketing. Numerical Weather Prediction (NWP) models can be used but they provide wind forecast as a single value for a given time horizon. Therefore, forecasting wind speed as a deterministic value doesn't represent the uncertainty of the wind speed forecast. Ensemble NWP forecast can be used to calculate the probability of occurrence of different wind speeds classes. The main disadvantage of this approach is the extensive computational resources required to run multiple copies of the NWP model. This paper, explores the possibility of using pseudo ensemble method for generating probabilistic wind forecast for wind farm applications. The proposed method utilizes the spatial and temporal neighborhoods of the forecast point to generate forecast dataset and then calculate the required probabilities. A case study using the proposed method is tested and validated using wind data from NWP model and measurements from three ground weather stations in Oman. © 2012 IEEE."""					
"https://www.scopus.com/inward/record.uri?eid=2-s2.0-84874503217&partnerID=40&md5=1a63449a43437092fd083cd998e52d3c,""This paper presents a load power management control strategy for the operation of a stand-alone variable speed wind turbine with a permanent magnet synchronous generator (PMSG) based on the state of charge (SOC) of the battery. The PMSG is connected to a three phase load through a switch mode rectifier and a voltage source inverter. Battery storage system is connected to the DC-link voltage through a DC-DC bidirectional converter to maintain the DC-link voltage at constant value. Also, it is used to make the batteries bank stores a surplus of wind energy and supplies this energy to the load during a wind power shortage. The SOC changes during charges/discharges the batteries bank. The instantaneous change in the SOC and its value are used to connect/disconnect some loads to/from the consumers' load. The voltage source inverter uses a relatively complex vector control scheme to control the output load voltage in terms of amplitude and frequency under variation of wind speed and load. Control of the generator side switch mode rectifier is used to extract maximum power from available wind power. Extensive simulations have been performed using MATLAB/SIMULINK. Simulation results demonstrate that the performance of the controller is quite satisfactory. © 2012 IEEE."""					
"https://www.scopus.com/inward/record.uri?eid=2-s2.0-84864827118&partnerID=40&md5=e6c5e04b4333f482bfeb8f1156929b19,""Despite the major progress made by Numerical Weather Prediction (NWP) in the last decades, meteorological models are usually unable to provide reliable surface wind speed forecasts, especially in complex topography regions, because of shortcomings in horizontal resolution, physical parameterisations, initial and boundary conditions. In order to reduce these drawbacks, one of the most successful approaches is the Kalman filtering technique, which combines recursively observations and model forecasts to minimise the corresponding biases. In meteorology, Kalman filters are widely used to improve the prediction of variables characterised by well-defined cyclicities, whereas the evolution of wind speed is usually too irregular. In the present paper, the Kalman filter is analysed in order to find the best configuration for wind speed and wind power forecast. The procedure has been tested, in a hindcast mode, with 2-year-long data sets of wind speed provided by a NWP model and two anemometric stations located in the eastern Liguria (Italy). It is shown that, tuning time step and forecast horizon of the filter, this methodology is capable to provide significant forecast improvement with respect to the wind speed model direct output, especially when used for very short-term forecast. In this configuration, Kalman-filtered wind speed data have been used to forecast the wind energy output of the nearby wind farm of Varese Ligure. After 2. years of testing, the percentage error between simulated and measured wind energy values was still very low and showed a stable evolution. © 2012 Elsevier Ltd."""					
"https://www.scopus.com/inward/record.uri?eid=2-s2.0-84867949474&partnerID=40&md5=5902bbb48ce8ac2a8a7130293b75edd2,""The rapid rise in clean energy initiatives has seen wind energy take center stage in renewable energies. A study of patent data of emerging wind energy players shows interesting trends in emerging technologies with a possibility to identify fast moving new entrants. The market value of patents is extremely skewed. This paper aims to confront patent value indicators for established wind energy players. The value indicators are measured using forward citation analysis, patent family size and International Patent Classification. The most important wind energy technologies and possible new entrants are determined using consultancy reports and interviews with experts. The value indicators are determined using the patenting activity of Siemens Wind and Vestas using the EPO Worldwide PATSTAT database. Technology managers can use these indicators for measuring the strength of patents. These indicators can provide basis for patent pricing and licensing. Furthermore, finding commercially valuable patents earlier can help business managers to formulate technology strategies and improve their decisions. © 2012 IEEE."""					
"https://www.scopus.com/inward/record.uri?eid=2-s2.0-84861828248&partnerID=40&md5=d73e19296337d0176b2339ca9b02ada4,""This study analyzes power storage as a key option to support wind energy integration. The case study is the French power system, whose characteristics rely on high rates of nuclear power and a strong emerging wind energy market. A dynamic optimization dispatching model is used to simulate the operation of the power system, under two development scenarios of the technology mix by 2030, one scenario documented by European Commission, EC [1], and a second one by French Transmission System Operator, RTE [2]. Both scenarios result in power storage requirements of around 7 TWh for more than 4 GW installed storage capacity of pumped hydro power plants in France as a whole. In this context, it is assessed the profitability of an additional regional project of Compressed Air Energy Storage (CAES) located in the region of Bretagne. It shows how benefits could accrue by avoiding the regional wind curtailment of 59 GWh, by providing ancillary services such as secondary reserve, and by increasing the use of grid assets and the nuclear power output with more than 230 GWh. The profitability of the CAES project remains however negative, around -70 /MWh despite the social value and the system benefits that results in. The study assesses qualitatively possible ways to incentivize the investment in new storage projects, through for instance contracts for difference, which would link the storage operation, its investment cost and stage of development to the power market design via power prices and a pre-defined rate of return. The periodical revision of these regulatory arrangements would enable the storage investor to recover the investment cost and would eliminate the risk of over rewarding generators in the case of windfall profits. © 2012 Elsevier Ltd. All rights reserved."""					
"https://www.scopus.com/inward/record.uri?eid=2-s2.0-84864794390&partnerID=40&md5=9d734a3b56ae9f7678f38151e746173e,""We critically review present knowledge of the life cycle environmental impacts of wind power. We find that the current body of life cycle assessments (LCA) of wind power provides a fairly good overall understanding of fossil energy use and associated pollution"	 our survey of results that appear in existing literature give mean values (± standard deviation) of, e.g., 0.060 (±0.058) kW h energy used and 19 (±13) g CO 2e emitted per kW h electricity, suggesting good environmental performance vis-à-vis fossil-based power. Total emissions of onshore and offshore wind farms are comparable. The bulk of emissions generally occur in the production of components	" onshore, the wind turbine dominates, while offshore, the substructure becomes relatively more important. Strong positive effects of scale are present in the lower end of the turbine size spectrum, but there is no clear evidence for such effects for MW-sized units. We identify weaknesses and gaps in knowledge that future research may address. This includes poorly understood impacts in categories of toxicity and resource depletion, lack of empirical basis for assumptions about replacement of parts, and apparent lack of detailed considerations of offshore operations for wind farms in ocean waters. We argue that applications of the avoided burden method to model recycling benefits generally lack transparency and may be inconsistent. Assumed capacity factor values are generally higher than current mean realized values. Finally, we discuss the need for LCA research to move beyond unit-based assessments in order to address temporal aspects and the scale of impacts. © 2012 Elsevier Ltd."""			
"https://www.scopus.com/inward/record.uri?eid=2-s2.0-84865031663&partnerID=40&md5=3089a8fc35058890960d05c329d34935,""Two commercial wind turbines namely AN Bonus 300. kW/33 and AN Bonus 1. MW/54 were technically assessed for electricity generation in six selected high altitude sites spreading across the North-West and North-East geopolitical regions of Nigeria by computing their capacity factors, annual power and energy outputs. The economic evaluation of using the two wind energy conversion systems (medium and large) for electric power generation in the selected locations were also estimated using the present value cost method. The results showed that capacity factors of the two turbines in the selected sites ranged between 4.6 and 43%. Average minimum cost per kW. h was obtained in Kano as $0.0222/kW. h with AN Bonus 1. MW while the highest average cost is $0.2074/kW. h with AN Bonus 300. kW in Kaduna. The highest cost in each of the location was obtained with the medium WECs (AN Bonus 300. kW). In addition, Kano and Katsina were also found to be very economical for any of the adopted wind turbine models. Gusau and Kaduna, at cost of unit energy of about $0.30/kW. h were found to be more profitable for non-connected electrical and mechanical applications (water pumping, battery charging) than diesel generator. © 2012 Elsevier Ltd."""					
